{
  "config_version": 1,
  "environment": "dev",
  "connection": {
    "connection_ref": "adp-dev-embark1",
    "repository": "aws-e/adp",
    "expected_account_id": "000000000000",
    "expected_org": "aws-e"
  },
  "identity": {
    "org_ref": "qual-org",
    "team_ref": "qual-team",
    "identity_ref": "qual-identity"
  },
  "versions": {
    "engine": "1.4.2",
    "worker": "0.9.0",
    "harness": "9072528a52f5a047a198281d8e642d4842a22525"
  },
  "bounds": {
    "max_resources": 5,
    "max_runs": 2,
    "max_usd": 5.0,
    "max_duration_seconds": 900
  },
  "artifacts": {
    "directory": "artifacts/qualification"
  },
  "secret_refs": {
    "github_app_key": "secretsmanager:adp/dev/github-app/private-key"
  },
  "scenarios": []
}
